{
  "schema_version": "1.1.0",
  "task_id": "vision_attention_b_v0",
  "tier": "B_library",
  "visibility": "public",
  "set_entry": "kb_l3_31",
  "case_generation": {
    "tool": "musa_operator_eval/tools/generate_cases.py",
    "deterministic": true,
    "note": "A public list never carries a library gap and never expects a non-fused path: that would hand the submission the configuration the task exists to make it discover."
  },
  "cases": [
    {
      "case_id": "smoke_001",
      "tag": "smoke",
      "seed": 1201,
      "dtype": "float16",
      "shape": {
        "B": 1,
        "C": 128,
        "channels": 128,
        "H": 32,
        "W": 32
      },
      "expected_path": "fused_library",
      "golden": "smoke_001/golden/tensors.json",
      "attributes": {},
      "distribution": "uniform",
      "tolerance_profile": "default"
    },
    {
      "case_id": "smoke_002",
      "tag": "smoke",
      "seed": 1202,
      "dtype": "bfloat16",
      "shape": {
        "B": 2,
        "C": 128,
        "channels": 128,
        "H": 64,
        "W": 64
      },
      "expected_path": "fused_library",
      "golden": "smoke_002/golden/tensors.json",
      "attributes": {},
      "distribution": "uniform",
      "tolerance_profile": "default"
    },
    {
      "case_id": "smoke_003",
      "tag": "smoke",
      "seed": 1203,
      "dtype": "float16",
      "shape": {
        "B": 1,
        "C": 128,
        "channels": 128,
        "H": 33,
        "W": 65
      },
      "expected_path": "fused_library",
      "golden": "smoke_003/golden/tensors.json",
      "attributes": {},
      "distribution": "uniform",
      "tolerance_profile": "default"
    }
  ]
}
