{
  "schema_version": "1.1.0",
  "task_id": "vision_attention_a_v0",
  "tier": "A_kernel",
  "visibility": "public",
  "set_entry": "kb_l3_31",
  "case_generation": {
    "tool": "musa_operator_eval/tools/generate_cases.py",
    "deterministic": true,
    "note": "Cases describe parameters and seeds only. Inputs are produced by the problem file's own get_inputs, so this manifest does not pin them."
  },
  "cases": [
    {
      "case_id": "smoke_001",
      "tag": "smoke",
      "seed": 1101,
      "dtype": "float32",
      "shape": {
        "B": 1,
        "C": 128,
        "channels": 128,
        "H": 32,
        "W": 32
      },
      "golden": "smoke_001/golden/tensors.json",
      "attributes": {},
      "distribution": "uniform",
      "tolerance_profile": "default"
    },
    {
      "case_id": "smoke_002",
      "tag": "smoke",
      "seed": 1102,
      "dtype": "float32",
      "shape": {
        "B": 2,
        "C": 128,
        "channels": 128,
        "H": 64,
        "W": 64
      },
      "golden": "smoke_002/golden/tensors.json",
      "attributes": {},
      "distribution": "uniform",
      "tolerance_profile": "default"
    },
    {
      "case_id": "smoke_003",
      "tag": "smoke",
      "seed": 1103,
      "dtype": "float32",
      "shape": {
        "B": 1,
        "C": 128,
        "channels": 128,
        "H": 33,
        "W": 65
      },
      "golden": "smoke_003/golden/tensors.json",
      "attributes": {},
      "distribution": "uniform",
      "tolerance_profile": "default"
    }
  ]
}
