{
  "schema_version": "1.1.0",
  "task_id": "swin_transformer_v2_a_v0",
  "tier": "A_kernel",
  "visibility": "public",
  "case_generation": {
    "tool": "musa_operator_eval/tools/generate_cases.py",
    "deterministic": true,
    "note": "Cases describe parameters and seeds only. Inputs are produced by the problem file's own get_inputs, so this manifest does not pin them. Public smoke cases use B=1..3; B=4 is reserved for the non-overlapping hidden shape domain."
  },
  "cases": [
    {
      "case_id": "smoke_001",
      "tag": "smoke",
      "seed": 1101,
      "dtype": "float32",
      "shape": {
        "B": 1,
        "image": 224
      },
      "attributes": {},
      "distribution": "uniform",
      "golden": "smoke_001/golden/tensors.json",
      "tolerance_profile": "default"
    },
    {
      "case_id": "smoke_002",
      "tag": "smoke",
      "seed": 1102,
      "dtype": "float32",
      "shape": {
        "B": 2,
        "image": 224
      },
      "attributes": {},
      "distribution": "uniform",
      "golden": "smoke_002/golden/tensors.json",
      "tolerance_profile": "default"
    },
    {
      "case_id": "smoke_003",
      "tag": "smoke",
      "seed": 1103,
      "dtype": "float32",
      "shape": {
        "B": 3,
        "image": 224
      },
      "attributes": {},
      "distribution": "uniform",
      "golden": "smoke_003/golden/tensors.json",
      "tolerance_profile": "default"
    }
  ]
}
